{
	"_id": "orcid:0000-0003-0019-1735",
	"_schema": "https://w3id.org/openebench/scientific-schemas/2.0/Person",
	"givenName": "Toni",
	"surname": "Gabaldon",
	"email": "toni.gabaldon@crg.eu",
	"notes": "QfO4 organizer",
	"links": [
		{
			"label": "MainSite",
			"uri": "http://www.crg.eu/es/programmes-groups/comparative-genomics"
		},
		{
			"label": "SocialMedia",
			"comment": "ORCID",
			"uri": "https://orcid.org/0000-0003-0019-1735"
		}
	]
}
